,content
37250,phonearena lg v rumored sport snapdragon gb ram dual front back camera id lg v rumored sport snapdragon gb ram dual front back camera lg v rumored sport snapdragon gb ram dual front back camera lg v rumored sport snapdragon gb ram dual front back camera posted tag lg lg lg v lg went rather difficult company attempted shake thing bold design g v handset gamble pay model failed entice mass consumer sold poorly result south korean firm reportedly changed tactic likely adopt traditional approach lg g premiere mwc around corner considerable amount information device biggest let down upcoming flagship probably sport latest high end soc qualcomm samsung effectively hoarded first batch snapdragon galaxy g make snapdragon might big disappointment fan brand however lg might actually redeem release v handset h latest speculation china weibo suggest v indeed host snapdragon boasting gb ram truly unique camera setup two set dual camera front back bunch mysterious feature mentioned although nothing specified rumor suggest take information pinch salt detail bound come next month stay tuned best keep updated
164803,pitchfork review album ride nelly furtado ride via soundcloud nelly furtado past decade split nicely two half winsome folk pop starlet amid cluster similar folkies turned timbaland collaborator amid cluster hard talk furtado career without mentioning impressive reinvention furtado stylistic chameleon able adopt almost style well better like bird turn light exuberance lacking anodyne soft rock dreary nu grunge alongside radio loose foreshadowed preternaturally assured verse missy elliott remix distinguished nearly every single even clich good girl gone bad narrative tread countless pop star furtado however far attempt another recapture spirit indestructible standouts alike parking lot overall pop audience bitten enter plan b going independent getting metaphorical dev hynes large hadron collider joining merrill garbus color guard show releasing series spacey single certain inevitability pop radio grows hostile female singer songwriter hostile ever older artist timbaland torpedoed relevance sound via succession bad track virtually furtado peer going route vanessa carlton released art pop record aspiration closer regina spektor rachel platten michelle branch cut album patrick carney furtado working st vincent producer john congleton always cause little confusion line mainstream alternative pop blur month reality tends let album slip radar thankfully furtado vibrancy elevates ride rote affair could flexibility asset attempt many style cold hard truth right road bassy strut swagger st vincent digital witness former call response interlude latter distorted guitar line stick stone arena synth rock blueprint pipe dream channel dev hynes gossamer r b carnival game phoenix piano ballad paris sun shockingly good effect recall goldfrapp steeliest given alison goldfrapp career followed near identical trajectory furtado maybe surprising ride primary flaw apparent mere title much record particularly ballad fall songwriter trap taking conceit writing every last bit subtext egregiously ride comeback record sort right cue closing ballad phoenix executed quiet assuredness track already done dozen time sometimes entirely furtado fault tap dancing written nashville songwriter natalie hemby liz rose best known working miranda lambert taylor swift respectively strives like many nashville portfolio piece stretch figure speech four minute without twang country artist give four minute pretty bland even track though redeemed furtado spirit indestructible tear every song indomitable energy usually production match though quite mesh ballad twitchy percussion carnival game least livens thing similar track might coast heroic synth riff stick stone push arrangement crescendo sound actually thrilling flatline subversion swedish pop style loud chorus complete snare drum firework two week piano pep set line feel nothing song equivalent hyperbole half cartoon album graphic emblem furtado settled sunflower sword symbol told billboard life beautiful painful like furtado best work peak ride capture
123873,rt merkel nato funding applauds merkel commitment boost nato spending rt applauds merkel commitment boost nato spending published time mar edited time mar get short url jim bourg reuters german chancellor promised best spend donald call fair share nato first official meeting u president despite commitment somewhat contradicting senior german official trend russia nato relation nato finance featured high agenda first face face meeting angela merkel predictably restated commitment making ally pay fair share two percent gdp maintain military alliance reiterated chancellor merkel strong support nato well need nato ally pay fair share cost defense joint white house conference friday many nation owe vast sum money past year unfair u merkel reassured nato prime importance u promptly pledged meet demand reach spending target read obsolete nato mean europe paying u militarism gratified know president underlined important think nato merkel committed percent goal last increased defense spending percent going work merkel seemingly softened stance spending issue make mention idea widen definition defense somewhat dodge demand question need question development aid crisis prevention others important merkel conference february belief aware nato value u change chancellor merkel tone surprising german academic economist professor richard werner belief much used getting order u although suppose used clearer singular line instruction u werner told rt moment bit confused getting probably set argument minder closely linked part u perhaps president criticizing president hand surprising end u merkel apparently caved u demand high ranking german official continue show reluctance towards straightforward spending increase read eu must let u push increase military spending juncker ahead merkel visit u germany defence minister ursula von der leyen suggested revising principle alliance member spending proposing activity index take account participation foreign mission active country according von der leyen idea pay le reluctant participate actual military activity fork question really providing added value alliance told von der leyen afp merkel however appeared ignore argument raise serious question germany independence werner noted could made case germany actually quite lot u sending german troop fight u war abroad werner germany unusual country question whether actually country whether occupation zone apparently occupation status still book course u legally still lot power germany earlier month german foreign minister sigmar gabriel questioned feasibility nato spending quota read shuns shaking merkel hand oval office encounter video concerned politician make public promise fulfill later gabriel apodictic percent goal rather moving direction five nato nation currently hitting two percent gdp spending mark u uk estonia greece poland u biggest contributor spending roughly time rest ally combined donald vowed change situation election campaign even calling alliance obsolete caused anxiety among european ally fueled idea separate eu army structure nato country however promised swiftly increase spending meet demand least country romania expects meet two percent mark meanwhile softened rhetoric clarifying alliance obsolete term confronting modern threat like global terrorism increasingly expressing strong support nato u president however seems equally committed idea making ally actually foot bill
101771,self story mark zuckerberg priscilla chan expecting another baby girl mark zuckerberg priscilla chan another baby way mark zuckerberg priscilla chan another baby way baby gender share via twitter anita bugge wireimage getty image facebook founder mark zuckerberg wife priscilla chan philanthropist pediatrician announced expecting second child another girl first daughter maximum max little old zuckerberg naturally shared big facebook post priscilla happy share expecting another baby girl wrote difficult experience max sure expect whether able another child priscilla first found pregnant first hope child healthy next hope girl cannot think greater gift sister happy max child previously zuckerberg chan three miscarriage getting pregnant max zuckerberg continued latest happy announcement discussing woman influenced fitting considering post come international woman grew three sister taught learn smart strong woman sister best friend gone write book excel performance music sport cooking career showed compete still laugh together afterward chan greatly influenced woman life zuckerberg wrote priscilla grew two sister taught importance family caring others hard work supported first generation college student career medicine business many inside joke kind sibling understand couple excited get raise another strong woman better people strong woman life sister mother friend zuckerberg wrote wait welcome little best raise another strong woman zuckerberg finished post four throwback photo chan kid posing sister hopefully max zuckerberg chan baby create shot someday check full post related
142,au finance business retail marc david lawrence placed voluntary administration story c f b b f add two australian fashion giant collapse marc david lawrence placed voluntary administration february staff affected aap share twitter leading fashion brand david lawrence marc placed voluntary administration administrator rodgers reidy director geoffrey reidy say two brand continue trade team review operation ahead planned sale business sole director company operating label malcolm webster say necessary appoint administrator deteriorating sale market condition poor cash flow brand operate stand alone store outlet concession store australia zealand ten store staff zealand staff including full time worker employed australia fashion brand told administrator employee wage paid january staff hear future manager customer gift card return honoured normal administrator
17195,smh au federal political malcolm turnbull convinced donald dump refugee deal gu qtg html malcolm turnbull convinced donald dump refugee deal prime minister malcolm turnbull reportedly persuaded donald honour refugee resettlement deal photo ap disclosure put complexion much discussed call ended mr describing worst call far series national leader according washington post account detail denied neither government experience seems may unpleasant get way cut short scheduled hour call minute advertisement clear whether mr opposed deal merely complained could seen reluctant argued term unhappiness display tweeted call mr turnbull study dumb deal spokesman sean spicer later conveyed reluctance told medium deal cut last administration something mr extremely extremely upset like respect mr turnbull going allow process continue study allow move forward condition set extreme vetting every single individual disclosure explains mr turnbull declined elaborate call saying ended courteously evidently want take credit publicly persuading mr change mind case antagonised u leader mr turnbull want give mr pretext revisiting vexed decision resisting arrangement mr told australian counterpart worst deal ever going get killed politically according washington post arrangement u accept asylum seeker two australian offshore camp originally struck betwen mr turnbull u president barack obama mr decided repudiate deal two men mr turnbull apparently persuaded deal two nation mr turnbull weekend absolutely request mr quid pro quo accurate true australian reciprocation separate earlier agreement australia agreed join u led multilateral plan resettle u refugee costa rica plan australia eventually accept costa ricans though none yet resettled third country two arrangement separate linked formal way represent effect trade sometimes happens ally wide range shared interest advertisement
155106,cbc ca canada saskatchewan sask budget cut tax hike cmp r alberta premier rachel notley blast sask tax hike budget cut tax hike cut public sector proposed saskatchewan latest budget hurt middle income family never fly next door alberta premier rachel notley say saskatchewan finance minister kevin doherty tabled deficit budget tuesday projected million shortfall fiscal includes percentage point provincial sale tax hike sask budget hike sale tax kill provincial bus company pst hike hit pocketbook opinion saskatchewan austerity budget come late believe approach thing alberta notley significant tax increase want back albertans think work albertans help collectively bringing economy recession period notley criticizes slashed tax exemption notley saskatchewan government walking back tax exemption previously meant help certain business thrive including construction sector construction service taxed alberta good reason notley british columbia province see construction handy way job creation handy way build infrastructure handy way create strong investment climate notley saskatchewan raised cost work zero six per cent taxing home construction draconian builder sask restaurant industry bracing pst impact saskatchewan budget remove previous tax exemption sale child clothing item something already drawing ire parent government saskatchewan announced budget week child clothing longer exempt provincial sale tax simon dawson bloomberg notley kind change line government value pull money economy slow economic recovery particularly pull money away regular middle income family notley one spend local economy want pull money away different approach labour cut saskatchewan party government seeking reduce overall public sector c ompensation million alberta government recently embarked path rein wage taxpayer funded position main target ceo public board agency notley key difference cut scare investor alberta saskatchewan government belief raising expanding pst bring extra million revenue cbc reached saskatchewan government yet received response file stefani langenegger
159175,mirror co uk celebrity jeremy mcconnell return instagram jeremy mcconnell return instagram dramatic week showing travel bag eotb rumour swirl celebs jeremy mcconnell return instagram dramatic week showing travel bag eotb rumour swirl irish model arrested last thursday released pending disposal decision share jeremy back instagram ad post photo instagram share get celebs update directly inbox subscribe thank subscribing could subscribe try later invalid email jeremy mcconnell returned social medium dramatic week rumour take part ex beach continue swirl irish model posted ad photo instagram overnight showing posing set clothes clutching travel bag giving shout brand wearing speculation recent week jeremy signed appear series mtv ex beach although show never confirms cast beforehand jeremy yet comment star holding travel bag wearing clothes ad post photo instagram read jeremy mcconnell enjoys night friend dramatic two week ex beach rumour continue swirl source told sun last month mtv boss wanted get jez show year finally signed ultimate lad producer know dead cert charm lady good craic boy hit viewer jeremy addressed eotb rumour share photo snapchat last week showing appeared yellow swimming trunk leaving wondering preparing abroad photo appeared snapchat jez yellow trunk photo snapchat video loading click play tap play video start cancel play
32935,nbcnews latino opinion ice deportation surge separating fact speculation n opinion ice deportation surge separating fact speculation let clear fan president immigration rhetoric recent immigration executive order looking recent immigration enforcement surge need take three deep breath separate known fact speculation remain vigilant first fact week february immigration custom enforcement ice surge preliminary information ice indicates targeted enforcement sweep immigrant defined criminal autoplay autoplay copy code website blog coordinated ice sweep targeting undocumented criminal nothing surge took place routinely obama administration sake comparison let zoom los angeles sector immigrant populous region country le ago mid july foreign national apprehended ice sweep targeting large criminal half individual felony conviction remaining misdemeanor last week los angeles sector foreign national apprehended criminal history five final order removal related ice arrest stir fear immigrant wary order quick comparison los angeles sector ice surge july february show big difference recent ice surge look like past couple year prioritized removal criminal foreign national following week month better able compare past current apprehension rate stand surge routine ice operation fact thus far cannot administration substantively anything differently obama administration stylistically though obama world apart president obama publicize ice surge instead letting ice carry policy whereas president highlighting surge twitter fulfillment campaign promise significantly thing devil detail important fact president executive order enhancing public safety interior u criminal status immigrant clear obama administration prioritization criminal violent offender top priority administration seem clear prioritization mean immigrant deportation order criminal record could technically classified criminal crucial thing look whether administration expand definition criminal offense include immigrant traffic violation early know whether administration expanded definition criminal end targeting non violent offender may traffic violation relatedly expanded definition could quickly inflate number ice deportation autoplay autoplay copy code website blog may well happen speculation based rhetoric rather factual confirmation better worse time tell speculation correct related arizona woman deported possibly first immigration order point giving speculation long leash undeniable fact emotion fear immigrant community running high issue deportation tear apart family represents cultural economic social uprooting delicate nature issue need proceed caution let speculation get best u immigrant immigrant advocate need prepare worst hope best meantime let paralyzing panic set follow nbc latino facebook twitter instagram
76049,hellomagazine celebrity natalie portman attending oscar ceremony oscar find natalie portman attending ceremony oscar find natalie portman attending ceremony february julie delahaye natalie portman revealed attending oscar ceremony nominated best actress portrayal jackie kennedy jackie leave comment natalie portman showcasing elegant maternity style oscar sunday night despite nominated best actress following portrayal jackie kennedy jackie old explained pregnant state giving academy award ceremony miss due pregnancy unable attend independent spirit award academy award wrote statement variety feel lucky honoured among fellow nominee wish beautiful weekend view gallery natalie portman attending oscar sunday night see latest oscar notorious keeping personal life private natalie caused stir venice film festival red carpet last unveiled blossoming baby bump looking epitome chic white valentino gown since star continued floor fan elegant maternity style including gorgeous pale pink number chose sag award view gallery actress expecting second child husband benjamin brunette beauty previously opened motherhood admitting played key role helping manage pressure work home life parenthood made much calmer stress told york time magazine weird parent thing develop thing get really bad voice get calm blood pressure slows make everything okay although garden state star absent oscar stranger hollywood glamorous bash oscar role black swan six year earlier nominated best supporting actress closer
25962,thesun co uk moon smash earth turn planet surface sea fire scientist warn moon locked death spiral earth york post able pay thing eye moon locked death spiral eventually cause smash earth astronomer warned apocalyptic event likely devastating turn surface home world seething pit red hot lava final end state tidal evolution earth moon system indeed inspiral moon subsequent collision earth jason barnes planetary scientist university idaho told forbes energy released merging melt earth magma ocean sadly human around see disaster probably wiped already according barnes theory moon crash earth billion year billion year everything planet burned alive death throe sun specie manages avoid wiped nuclear war doomsday space rock apocalyptic epidemic may live see closest star swallow much solar system five billion year sun grown red giant star hundred time larger current size professor leen decin ku leuven institute astronomy last experience intense mass loss strong stellar wind end product evolution billion year tiny white dwarf star size earth much heavier tea spoon white dwarf material weighs ton share
87166,u federal judge release wife orlando nightclub shooter custody story id federal judge release wife orlando nightclub shooter custody federal judge release wife orlando nightclub shooter custody placing house arrest julia jacobo mar share watch wife orlando nightclub shooter house arrest share email federal judge oakland ordered house arrest wife orlando nightclub shooter omar mateen ahead trial felony charge related massacre freeing mateen widow noor salman federal custody pending trial federal magistrate donna ryu cast doubt strength government case salman arrested january facing two felony charge allegedly aiding abetting mateen provision material support terrorist group isi obstructing investigation massacre find time weight evidence debatable ryu information provided government hotly debated bulk government case relies admission salman allegedly made toward end interrogation occurred hour detention federal prosecutor salman car omar mateen cased three potential orlando location couple spent using credit card day shooting made salman death beneficiary mateen bank account created cover story telling family going dinner friend alleged admission may vulnerable constitutional attack ryu judge added strength government evidence beyond admission debatable time prosecutor provide enough evidence court keep salman behind bar establish clear evidence salman violent dangerous ryu joe raedle getty image law enforcement official continue investigation pulse gay nightclub june orlando florida salman mother uncle serve custodian offered house property equity secure bond wear ankle bracelet monitoring unit uncle responsible monitoring supervising salman time salman permitted leave uncle home meet attorney attend son medical mental health treatment allowed leave house grocery shopping run errand government asked salman detained released bond citing terrorism charge facing salman immediately released federal custody giving prosecutor hour appeal judge ruling condition release salman able travel outside california florida travel two state advance approval house arrest salman cannot passport travel visa issued permitted carry firearm house orlando police chief john mina disappointed salman released federal custody nothing erase pain feel senseless brutal murder neighbor friend family member loved one chief statement adding full faith ultimately brought justice june mateen killed people injured dozen opened fire popular orlando nightclub prosecutor allege salman knew husband going attack accuse lying police federal investigator salman entered guilty plea charge hearing january interview york time november salman unaware everything condone done abc rachel katz contributed report share
