,content
110315,theguardian society mar public sector worker cut pay resolution foundation public sector worker first face cut real pay say thinktank society public sector worker become first group suffer cut real wage since recovery forecaster predicted rest working population follow suit later resolution foundation situation million public sector worker expected worsen rest decade pay restraint high inflation eat take home pay living standard independent thinktank forecast median real pay average public sector worker fall level end current parliament uk social care staff shortage put sector crisis read current trend average pay public sector worker lower peak pay figure year financial crash show private sector worker bore brunt slump wage private sector worker suffered wage freeze worse public sector pay improved offsetting steeply rising inflation since economy picked price flatlined private sector worker grabbed lion share inflation busting wage rise official figure showed full time employee private sector enjoyed increase median weekly earnings earlier compared rise worker public sector inflation jumped january expected rise end resolution foundation pay growth particularly weak health social work could fall though lowest earner protected falling pay planned increase national living wage study january tuc calculated midwife teacher social worker see real pay account impact inflation drop government stick plan limit salary increase pay rise year ifs warns uk worker read adam corlett economic analyst resolution foundation rising inflation applying brake real pay growth across board outlook public sector pay look particularly weak pay actually falling worse expected continue rest parliament level end parliament dropping back level last seen although public sector pay restraint important government deficit reduction plan falling real pay likely see increasing recruitment strain government planning manage strain alongside wider change policy like migration impact philip hammond promised increased spending school spring budget chancellor extra money spent opening school increasing teacher pay amount spent pupil central government department local authority must find extra saving meet aggressive budget target limiting scope incremental increase staff pay outside annual pay constraint topic public sector cut economics public finance public service policy
98530,mirror co uk tv tv tom fletcher let slip wife tom fletcher let slip wife giovanna fletcher body shamed hospital staff day giving birth thank subscribing tom fletcher revealed wife giovanna fletcher body shamed hospital staff e day giving birth previously confessed taunted post baby body mcfly singer accidentally let slip really happened morning today someone work e supposed looking u married couple talking itv daytime show giovanna never bit read giovanna got body shamed hospital staff photo itv photo itv photo itv giovanna previously explained old tom jaw dropped wife told mummy still got tummy fan gave birth buddy someone park explained tom jaw dropped think neither u could believe know afterwards came back home spoke mum dad speaking giovanna declined chance snap woman tom newborn buddy woman continued ok maybe another time face slimmed morning interview giovanna told holly willoughby phillip schofield book happy mum happy baby talk experience motherhood pcos miscarriage write pcos miscarriage tell tom going let read read
31742,southafrica inside top cop fight back campaign ipid inside top cop fight back campaign ipid johannesburg acting police chief khomotso phahlane intensified fight back campaign police watchdog allegedly roping controversial senior policeman major general ntebo jan mabula lead retaliation appears phahlane gone far getting specialised police team investigate investigating mabula investigated independent police investigative directorate ipid team leader mabula history involved politically motivated arrest close ally former police bos jackie selebi suspended crime intelligence head richard mdluli phahlane centre ipid investigation defeating end justice alleged corruption looking paid r home luxurious sable hill waterfront estate acting commissioner come gun blazing inclusion forensic investigator paul sullivan assistant attorney sarah jane trent investigation last week filed application north gauteng high court ipid sullivan trent magistrate jr tsatsi stop sullivan trent taking part investigation overturn search warrant saw ipid enter home remove r sound system appears acting commissioner gone step court application trent arrested friday afternoon allegedly impersonating ipid officer driven around hour taken kameeldrift police station first police denied raid sullivan office arrest hawk spokesperson brigadier hangwani mulaudzi told numerous medium outlet initiated raid sullivan office police spokesperson brigadier sally de beer told ewn aware arrest denial stopped afriforum brought urgent application north gauteng high court sunday afternoon trent released custody ipid head robert mcbride attended court appearance giving support trent mdluli associate mabula travelled klerksdorp headed arrest trent according source close investigation discovered team north west tasked looking investigating phahlane allegation witness corruption case approached team mabula previous head hawk north west name appeared frequently medium past year city press reported mabula long term associate suspended crime intelligence head lieutenant general richard mdluli served detective potchefstroom north west mdluli headed organised crime unit mdluli instruction mabula involved failed prosecution arrest gerrie nel nomgcobo jiba nel arrest police commissioner jackie selebi launched urgent application try halt scorpion investigation mabula led hawk investigation called cato manor death squad jibas instruction arrested kwazulu natal hawk head major general johan booysens racketeering charge later declared unlawful court mabula still investigation ipid alleged murder suspect police custody city press reported mabula investigated death suffocation police informer solomon nengwane r heist nengwane allegedly involved stealing r r recovered heist money police station benoni death allegedly hand task team detective command mabula colonel heist saw r stolen tambo cargo terminal four suspect case killed shortly heist prosector peter smith told court seemed police knocking witness cover track case post mortem report revealed nengwane tortured electricity shock tube used choke understands week mcbride present never seen evidence parliament portfolio committee police investigation phahlane asked phahlane fighting back ipid investigation opening case sullivan trent mabula tasked investigating de beer enquiry relates ongoing investigation involves matter court police able respond please note police investigation court directed de beer information investigative journalist send email tip
151378,vanguardngr suicide major sin allah suicide major sin allah home religion belief facing ka aba suicide major sin allah suicide major sin allah facing ka aba urowayino warami comment ne sin muslim commit inadvertently abandoning muslim brother three day u part world guilty lot reason adduced inadequacy blame busy schedule life live brotherhood islam matter obligation matter choice becomes sin fail fulfill part muslim brother comprehensive concept based upon good character others treating others way want treated uniting common value every muslim must exist sense community friendship common purpose islam sake allah know happening another brother offer assistance individually collectively segregation showing lack concern others forsaking another muslim brother way shaytan cause division among muslim dispute trivial disagreement may enough except based committing sin allah trivial disagreement matter difference muslim must never house ignoring happens encounter gathering sin cause weakness muslim community hence ruling concerning decisive warning stern abu hurayrah may allah pleased reported prophet w permitted muslim forsake brother three day whoever dy enter hell reported abu dawud see saheeh al jaami issue suicide major sin muslim right take life matter circumstance prophet taught commits suicide dwell eternal hell fire adding allah punish mean used commit suicide narrated abu hurayrah may allah pleased prophet blessing peace allah upon whoever throw mountain kill throwing fire hell ever ever whoever drink poison kill sipping fire hell ever ever whoever kill piece iron iron hand thrusting belly fire hell ever ever narrated al bukhaari muslim another related hadith prophet w whoever kill something punished resurrection narrated al bukhaari muslim narrated jundub ibn abd allaah may allaah pleased messenger allah w man among came wounded panicked took knife cut hand bleeding stop died allah may glorified exalted slave hastened death forbidden paradise narrated al bukhaari muslim another important thing note scholar cleric islam may refrain offerring janaza anyone commits suicide follows action prophet w refrained offering funeral prayer committed suicide punishment deterrence although given permission people offer funeral prayer narrated jaabir ibn samurah may allaah mercy man killed broad arrow head brought prophet peace blessing allaah upon offer funeral prayer narrated muslim believer kind trauma patient seek help allah understand matter hardship befalls world matter severe punishment hereafter worse acceptable according anyone right mind run away heat desert throw fire flee temporary hardship difficulty inevitably come end eternal punishment end eternal punishment muslim circumstance ponder realise world affected adversity different kind adversity befell greatest mankind namely prophet messenger righteous befell worst mankind namely disbeliever atheist part natural order thing issue occurence sometimes painful hardly anyone safe human bound face must endeavour overcome matter difficult even taught even pain hardship sickness grief befalls believer remains steadfast overcome bad deed expiated believer handle well remains steadfast becomes mean make turn back allah strive hard worship righteous deed calamity good expiation sin perhaps meet allah burden sin may allah give u taqwa keep u away sin enough devotion obedience help u reach paradise amin urowayino warami
59964,startribune aboard east wisconsinite plot rail twin city aboard east wisconsinite plot rail twin city east metro resident fight way work amid thousand wisconsin commuter may get lift work courtesy train coming badger state push privately financed passenger rail service eau claire st paul union depot stop stillwater train official planning policy minnesota since wisconsin county board day ago passed resolution supporting project amid concern critic taxpayer end tab private line fails push line fueled business interest coming west central wisconsin rail coalition strong residential growth east metro job base lean west east metro motorist often face plugged tight commute turn epic hint serious weather man life minnesota side jan johnson credit union executive eau claire u always going direction fortunate winter year lot canceled weekend business trip something always monitor without able make firm plan inconvenience everyone whether receiving person traveling ten thousand wisconsin commuter pour minnesota morning hudson st croix county alone study show rail capture fraction traffic nevertheless based prospect hundred thousand ride annually minnesota department transportation study classed eau claire rail corridor phase project top priority good potential recover cost fare proposed service eau claire st paul trip four way hour min travel time fare cent per mile full fare st paul eau claire discount regular travel connection express bus airport light rail amtrak intercity bus taxi car rental amenity wi fi food drink source west central wisconsin rail coalition existence union pacific rail track sitting ready train long seemed minnesotan obvious solution planner conditional approval union pacific use track expensively refurbished union depot downtown st paul connection include smooth green line light rail trip across town minneapolis taxpayer concern le expensive home found much metro area seven wisconsin county closest job twin city seen strong growth wisconsin business association report building permit leapt percent two year ending plan rail line catering resident call kind privately financed operation public private partnership beginning sprout elsewhere country example florida train brightline service miami northward along atlantic coast unveiled january plan launch wisconsin rail coalition retired minnesota state government rail planner shepherding effort capable team brian nelson aboard minnesota rail advocacy group union pacific invested lot line main line could probably mile hour today without improvement could allow greater speed scott rogers governmental affair workforce director eau claire area chamber commerce coalition hope cover operating cost fare box looking operating subsidy know public money involved chippewa county wi commissioner month voted give rail coalition support move start gathering endorsement public body smelling boondoggle sitting around coming project posed anonymous reader chippewa herald going fall onto local state tax pay financial shortfall reason want offer create urban sprawl chippewa offer small town feel people want work city much work remains last part actually big element pitch rail lose lot good graduate western wisconsin university minnesota work feel move johnson train could get town quickly via car minnesota suburb could working ridership potential portion metro area extends western wisconsin significant enough planner spent lot time trying pencil push across state line proposed gold line busway woodbury lyssa leitner washington county transportation planner cost u bus rapid transit mean frequent service train offer four trip daily way fact estimated start capital cost range million million nelson show lot figuring still need done determine much work required group stress need ultimately extend line chicago make viable support coalition proposal according latest newsletter minnesota association railroad passenger belief type line could unite urban rural interest get millennials company employ settle community couple train connecting nearest big city newsletter business like low tax employee prefer small town life get away big city weekend without lot highway hassle overpriced downtown parking
121782,mashable slow motion dolphin film crew zealand gang dolphin refuse stop showing front film crew gang dolphin refuse stop showing front film crew dolphin cheeky gorgeous know especially guy captured super slow mo high quality film equipment happened begin leaping front film crew sea show offs damian christie team way back zealand pelorus sound gang attention seeking bottlenose dolphin began jumping air front look begging close moment get grip guy christie told storyful experience shared facebook magical look going lie awesome keep beautiful dolphin
160342,avclub article mobile game put middle archer dreamla newswire mobile game put middle archer dreamland action archer image fxx archer image fxx two week release archer dreamland latest weirdest season date fx fxx debonair superspy turned comatose private eye sterling archer personal note show reviewer v club fantastic fan probably spend intervening time sharpening favorite obscure literary reference phrasing joke fxx offering fun little distraction alternative archer p augmented reality mobile game set let player play along show noir tinged season download game available io android plunked office woodhouse archer gumshoe archer latest partner drink pourer actual gameplay far mostly involves tapping item screen taking picture archer related promo material kind heart breaking get h jon benjamin provide vocal season premiere april idea case every episode although clear meaty meantime clue hunter dig show trailer poster early ar find already submit newswire tip
137655,vice story isi claim responsibility deadly terror attack london isi claim responsibility deadly terror attack london isi claim responsibility deadly terror attack london david gilbert mar islamic state group claimed responsibility terror attack outside u k parliament london wednesday left three people dead injured statement spokesperson terrorist group perpetrator soldier islamic state detail emerged thursday morning man carried car knife attack prime minister theresa may confirmed suspect british citizen known intelligence service thought serious threat nature claim frame attack inspired directed distinction hugely important charlie winter charliewinter march investigation attack continues police confirmed carried raid house london birmingham overnight arresting eight people connection incident breaking isi amaq claim london parliamentattack carried soldier caliphate pic twitter xqtpvonp k rita katz rita katz march mark rowley acting deputy commissioner metropolitan police revised total number fatality three authority initially stated four victim died attack need know may told parliament attacker acted alone reason believe imminent attack suspect investigated mi year ago violent extremism may added peripheral figure case historic part current intelligence picture british prime minister theresa may million act normality find best response terrorism pic twitter cymmkopq march may added threat level u k raised severe attack powerful statement may afraid resolve never waiver face terrorism million act normality find best response terrorism attacker drove car high speed across westminster bridge central london mounting pavement killing injuring pedestrian get way time car rammed fence surrounding government building attacker ran toward gate fatally stabbing police officer armed police shot dead ground parliament londoner never cowed terrorism pic twitter sidiuiztvu mayor london mayoroflondon march people remain hospital seven critical condition among injured attack briton three french child two romanian four south korean two greek person germany poland ireland china italy united state three police officer injured two seriously overnight police force across country made eight arrest following raid home london birmingham part country according four arrest occurred single flat birmingham wednesday night identity killed made public keith palmer policeman stabbed death attacker gate westminster palmer married father member met parliamentary diplomatic protection command year service police officer may every inch hero aysha frade teacher mother two died struck attacker car westminster bridge walking home school man utah celebrating th wedding anniversary london confirmed dead spokesperson family kurt cochran family heartbroken learn death son law kurt w cochran victim wednesday terrorist attack london attacker shot killed armed policeman cover associated press
86431,southafrica cape water restriction remain dam reach cape water restriction remain dam reach cape water restriction remain dam reach paul herman city cape town implemented level b water restriction response ongoing drought dam level currently lower point since watch cape town dam level low cape town water restriction western cape remain place dam reached capacity minister presidency jeff radebe thursday cabinet looking way help province current water supply run told journalist post cabinet briefing attempt need instituted provide greater comfort form additional alternate water supply source must standby inadequate water received season radebe welcomed much needed rain part country warned possibility flash flooding government ready act happen south africa host unesco proposed world water march theme waste water untapped resource join conversation encourages commentary contribution word considered publication reserve editorial discretion decide published
89660,metro co uk fabio cannavaro belief tianjin quanjian sign evertons romelu lukaku everton romelu lukaku could join tianjin quanjian say fabio cannavaro metro george bellshaw metro co uk friday mar lukaku target several club around europe picture getty tianjin quanjian bos fabio cannavaro belief chinese club chance landing manchester united chelsea target romelu lukaku italian world cup winner convinced wealth available side far east give shot landing world best player revealing rejected move marouane fellaini former real madrid centre back confirmed side made approach old everton star everton unwilling sell cannavaro still harbour hope landing lukaku premier league stats game goal assist convinced lukaku young age count side signing belgian striker lukaku could perfect china look oscar swapped chelsea shanghai sipg football football world every player want play club win
170064,indianexpress article trending viral video trending medic columbia dancing around patient viral video get backlash watch medic fired dancing around patient preparing surgery video draw huge backlash indian express watch medic fired dancing around patient preparing surgery video draw huge backlash watch medic fired dancing around patient preparing surgery video draw huge backlash shocking trend desk delhi published march video garnered huge outrage backlash social medium apparently medical staff fired broke health protocol source daily mail online twitter inside hospital especially around operation theatre see sense emergency around doctor medical help life saved wound healed doctor job known life saving vocation video going viral seems probably case everywhere shocking video show nurse doctor reportedly columbia dancing around patient prepared operation video garnered huge outrage backlash social medium apparently medical staff fired broke health protocol outrageous clip show staff shrub seemingly mocking dancing amidst laugh around patient lying upside clothes incident reportedly took place santa cruz de bocagrande clinic bolivar columbia latest india download indian express app online medium service pvt ltd best express
129928,mic article flower infused vodka favorite cocktail flower infused vodka favorite cocktail flower vas work martini glass floral infused vodka preserve freshness beautiful bouquet bottle round want drink gorgeous garden unlike artificially flavored vodka chemically altered taste like marshmallow fruit plate sriracha another drink entirely mimosa vodka thing infused vodka get unique taste natural botanical release flavor booze similar making tea stirring sugar tea according history vodka vil iam vasil evich pokhlebkin vodka received infusing treatment since th century additive intended impart particular taste including orange blossom caraway pepper flower herb hundred year later bartender home mixology geek embraced tradition infusing vodka flavor bottled variety make easier ever sip bouquet ice sage advice source giphy oprah august list tip peony vodka distilled five time infused botanical ranging geranium white pepper peony flower gardenia going want grab bottle booze obsession vast majority vodka market either neutral meaning seek odorless tasteless flavored artificial ingredient leslie farhangi founded peony vodka three meadow spirit via email using natural floral essence feel able capture flavor ambience relaxed country lifestyle many people tell like smell flower adage say always take time stop smell flower peony vodka created ingredient cultivated york hudson valley hour city farm date back th century old duchess county farm sits row antique peony flower farhangi explained wanted use vodka recipe rich botanical floral vodka source giphy peony flavored vodka flavor aroma make perfect enjoying rock cocktail farhangi noting botanical blend enhances literally traditional vodka gin cocktail think plain table table decorated flower yeah know better peony may mystical taste botanical infusion natural health benefit added quantity great enough actually affect health sadly claim peony health drink exception lending relaxation good time family friend farhangi cheer drink peony straight ice favorite mixed drink
140474,theblaze president announces final approval keystone xl pipeline president announces final approval keystone xl pipeline tweet long anticipated decision administration president donald announced final approval friday transcanada begin completion construction keystone xl pipeline intended bring oil canada united state gulf coast work pipeline stalled since november obama administration refused deny transcanada necessary federal permit complete construction pipeline month contentious protest environmentalist pipeline construction site move sharply criticized candidate promised reverse obama administration decision made fulfillment promise top priority incoming administration liberal environmental activist claimed month direct financial interest construction pipeline however claim divested interest company involved construction pipeline election today decision remove last federal obstacle way keystone xl pipeline construction potential hurdle remain including potential state permit issue pipeline proposed path cross sovereign native american territory may complicate transcanada effort finish construction billion project transcanada estimate construction work project create job next two year
