,content
80319,cbc ca technology spacex people moon spacex fly people moon next spacex fly people moon next people approached company asking week long trip associated press posted feb last updated feb spacex ceo elon musk speaks unveiling dragon v spacecraft hawthorne california may musk announced monday company plan send people orbit around moon mario anzuoni reuters related story spacex say fly two people moon next surprising announcement made company chief elon musk monday two people know another approached company sending week long flight beyond moon musk identify pair price tag say already paid significant deposit spacex launch st rocket since explosion florida musk say spacex track launch astronaut international space station nasa mid moon mission follow six month later using dragon crew capsule falcon heavy rocket musk say moon mission designed autonomous unless something go wrong spacex say passenger fly moon land
158675,newsinfo inquirer net senator urge govt protect every filipino senator urge gov protect every filipino inquirer net march sen grace poe inquirer file photo grig c montegrande extrajudicial killing ejks government must protect life every filipino especially poor senator grace poe tuesday life every filipino rich poor protected government number casualty point poe statement whether seven thousand two thousand seven two whether called ejk collateral damage law enforcement must never lose sight justice humanity advertisement read chr exec say killing state sponsored poe issued statement sought comment philippine national police pnp chief director general ronald bato dela rosa claim ejks country blamed medium sensationalizing misinterpreting number death government war drug contrary reported ejks country pnp placed total number killing country july march number pnp confirmed drug related drug related case remained investigation joint panel senate already investigated alleged ejks country report showed proof killing state sponsored poe among sign report maybe committee report right state sponsored ejk could discussion state stop senator earlier interview talk ejks two thing involved state sponsored number two state sponsored state done avert added cbb
6098,globalnews ca lychee fruit blame mystery illness killing child india scientist lychee fruit blame mystery illness killing child india scientist globalnews ca february lychee fruit blame mystery illness killing child india scientist jenny rodrigues multimedia producer global watch unassuming fruit culprit behind mystery disease killed hundred child east india every since sponsored content written global editorial staff without editorial influence sponsor like learn x sponsored content written global without editorial influence sponsor like learn every spring since child town muzzafarpur india fall ill experience seizure fall comatose many die per cent could explain suddenly outbreak sprang mid may disappear july story continues doctor india national center disease control american center disease control prevention embarked study pinpoint culprit behind mystery disease report published medical journal lancet global health reported consumption lychee fruit empty stomach blame read cdc confirms child washington state rare polio like illness dubbed afm muzzafarpur india largest lychee farming region account per cent country lychee harvest investigator looked hundred child admitted local hospital similar symptom child admitted died researcher checked sign infection elevated pesticide level came short tested blood glucose level affected child compared level child exhibit mystery illness symptom glucose level sick child low comparison seemed little signal cdc epidemiologist padmini srikantiah told york time thing heard multiple time child mother really eat dinner properly addition found high level hypoglycin methylenecyclopropyl glycine mcpg two third child urine naturally occurring toxin found fruit cause glucose deficiency metabolic derangement read toddler dy misdiagnosed time family reeling study researcher many child parent reported kid frequently neighbouring orchard eat lychee fruit lose appetite want eat dinner concluded synergistic combination lychee consumption missed evening meal potential factor poor nutritional status eating greater number lychee yet unidentified genetic difference might needed produce illness following study indian government issued public health recommendation minimize consumption lychee fruit among child affected region ensure eat dinner outbreak period case illness reportedly fell le past researcher believe study may help shed light similar outbreak lychee growing region bangladesh vietnam although thorough investigation area yet done
1389,chron houston texas houston article year ago space shuttle columbia broke php year ago space shuttle columbia broke returning home photo houston chronicle image caption close image front page extra edition published houston chronicle shown saturday feb houston space shuttle columbia broke apart flame foot texas killing seven astronaut minute glide landing florida le front page extra edition published houston chronicle shown saturday feb houston space shuttle columbia broke apart flame foot texas killing seven photo houston chronicle image houston chronicle front page february mourn nasa inquiry focus tile damage bush vow space program continue astronaut perish tragedy texas houston chronicle front page february mourn nasa inquiry focus tile damage bush vow space program continue astronaut perish tragedy texas photo houston chronicle pdf image image television contrail appears space shuttle columbia seen streaking across sky texas saturday feb columbia apparently disintegrated flame minute land florida le image television contrail appears space shuttle columbia seen streaking across sky texas saturday feb columbia apparently disintegrated flame photo tel image debris space shuttle columbia streak across sky tyler feb amateur photographer dr scott lieberman shot series photo showing break space shuttle backyard tyler columbia broke apart flame foot texas killing seven astronaut minute glide landing florida le debris space shuttle columbia streak across sky tyler feb amateur photographer dr scott lieberman shot series photo showing break space shuttle image debris space shuttle columbia streak across sky tyler texas saturday feb amateur photographer dr scott lieberman shot series photo showing break space shuttle backyard tyler early saturday space shuttle columbia broke apart flame foot texas saturday killing seven astronaut minute glide landing florida le debris space shuttle columbia streak across sky tyler texas saturday feb amateur photographer dr scott lieberman shot series photo showing break space photo dr scott lieberman ap image mac powell stand next belief suspected damaged left wing fallen space shuttle columbia property nacogdoches county sunday evening february found wreckage sunday morning complete several damaged heat tile le mac powell stand next belief suspected damaged left wing fallen space shuttle columbia property nacogdoches county sunday evening february found photo karen warren staff image space shuttle columbia crew left right front row rick husband kalpana chawla william mccool back row david brown laurel clark michael anderson israeli astronaut ilan ramon shown undated crew photo le space shuttle columbia crew left right front row rick husband kalpana chawla william mccool back row david brown laurel clark michael anderson israeli astronaut ilan ramon shown image crew space shuttle columbia left bottom row chawla husband clark ramon top row brown mccool anderson crew space shuttle columbia left bottom row chawla husband clark ramon top row brown mccool anderson photo uncredited hogp image timed exposure space shuttle columbia mission sts launch pad complex kennedy space center turn space vehicle support facility nighttime fantasy light first shuttle launch april le timed exposure space shuttle columbia mission sts launch pad complex kennedy space center turn space vehicle support facility nighttime fantasy light image copy texas license plate unveiled friday jan austin texas honor crew space shuttle columbia disintegrated texas last killing seven astronaut click see shuttle program ended year later nasa retired shuttle le copy texas license plate unveiled friday jan austin texas honor crew space shuttle columbia disintegrated texas last killing seven photo harry cabluck ap image space shuttle atlantis land completing final mission space shuttle program july kennedy space center space shuttle atlantis land completing final mission space shuttle program july kennedy space center photo james nielsen chronicle image johnson space center security officer lower space shuttle atlantis mission flag johnson space center houston atlantis landed kennedy space center july johnson space center security officer lower space shuttle atlantis mission flag johnson space center houston atlantis landed kennedy space center july photo david j phillip associated press image johnson space center director michael coat left presented atlantis mission flag andrew kohlmeyer right houston space shuttle atlantis landed kennedy space center july landing atlantis brings space shuttle program end le johnson space center director michael coat left presented atlantis mission flag andrew kohlmeyer right houston space shuttle atlantis landed kennedy space center july photo david j phillip associated press image space shuttle atlantis lift launch pad sts international space station mission final launch shuttle program july kennedy space center space shuttle atlantis lift launch pad sts international space station mission final launch shuttle program july kennedy space center photo james nielsen chronicle image image provided nasa international space station taken member atlantis sts crew fly around shuttle departed station july sts final shuttle mission orbital laboratory le image provided nasa international space station taken member atlantis sts crew fly around shuttle departed station july sts final photo nasa associated press image television image combined crew atlantis i seen reflected window johnson space center final shuttle crew conference international space station july houston le television image combined crew atlantis i seen reflected window johnson space center final shuttle crew conference international space station july photo smiley n pool chronicle image space shuttle endeavour land orbiter final mission wednesday june kennedy space center space shuttle endeavour land orbiter final mission wednesday june kennedy space center photo james nielsen chronicle image docked space shuttle endeavour sts backdropped night time view earth starry sky featured image photographed expedition crew member station docked space shuttle endeavour sts backdropped night time view earth starry sky featured image photographed expedition crew member station photo nasa image may photo made expedition crew member paolo nespoli soyuz tma following undocking released nasa show international space station docked space shuttle endeavour left altitude approximately mile soyuz capsule never headed home shuttle parked space station providing rare opportunity photo session le may photo made expedition crew member paolo nespoli soyuz tma following undocking released nasa show international space station docked space shuttle photo paolo nespoli nasa associated press image nasa astronaut nicholas patrick sts mission specialist participates mission third final session extravehicular activity eva construction maintenance continue international space station le nasa astronaut nicholas patrick sts mission specialist participates mission third final session extravehicular activity eva construction maintenance continue international photo nasa image tightly cropped image nasa space shuttle atlantis seen silhouette solar transit tuesday may florida image made atlantis crew sts grappled hubble space telescope le tightly cropped image nasa space shuttle atlantis seen silhouette solar transit tuesday may florida image made atlantis crew sts photo nasa image space shuttle endeavour mounted atop modified boeing carrier aircraft fly california mojave desert way back kennedy space center florida space shuttle endeavour mounted atop modified boeing carrier aircraft fly california mojave desert way back kennedy space center florida photo nasa image enthusiastic crowd titusville fla watch space shuttle atlantis launch kennedy space center mission sts feb enthusiastic crowd titusville fla watch space shuttle atlantis launch kennedy space center mission sts feb photo steve ueckert chronicle image lightning hit foot vehicle assembly building thunderstorm pass kennedy space center march lightning hit foot vehicle assembly building thunderstorm pass kennedy space center march photo steve ueckert chronicle image space shuttle columbia crew member strike flying pose traditional flight crew portrait research lab aboard shuttle photo january released nasa tuesday june clockwise left kalpana chawla david brown william c mccool michael p anderson ilan ramon laurel b clark rick husband seven crew member lost feb le space shuttle columbia crew member strike flying pose traditional flight crew portrait research lab aboard shuttle photo january released nasa tuesday photo ap image high angle image space shuttle atlantis backdropped desert photographed feb three man expedition crew aboard international space station shortly shuttle outpost unlinked following several day joint operation two crew credit nasa le high angle image space shuttle atlantis backdropped desert photographed feb three man expedition crew aboard international space station shortly photo nasa image sts payload commander steven l smith retrieves power tool standing mobile foot restraint end remote manipulator system hubble servicing mission sts payload commander steven l smith retrieves power tool standing mobile foot restraint end remote manipulator system hubble servicing mission photo nasa image ohio sen john glenn wave applauding fan veteran parade nov downtown houston glenn discovery astronaut nasa astronaut corp attended parade ohio sen john glenn wave applauding fan veteran parade nov downtown houston glenn discovery astronaut nasa astronaut corp attended parade photo smiley n pool chronicle image crowd along banana river titusville fla watch oct liftoff discovery thousand watched shuttle roar skyward sen john glenn aboard crowd along banana river titusville fla watch oct liftoff discovery thousand watched shuttle roar skyward sen john glenn aboard photo steve ueckert chronicle image five sts astronaut aboard space shuttle atlantis look overhead window aft flight deck toward counterpart aboard mir russian space station rendezvoused le five sts astronaut aboard space shuttle atlantis look overhead window aft flight deck toward counterpart aboard mir russian space station photo nasa image rick hieb mission specialist aboard sts look aft flight deck orbiter spacewalk sts launched may returned earth may marked first flight endeavour le rick hieb mission specialist aboard sts look aft flight deck orbiter spacewalk sts launched may returned earth may marked first photo nasa image space shuttle atlantis streak skyward sunlight pierce gap orbiter assembly aug space shuttle atlantis streak skyward sunlight pierce gap orbiter assembly aug photo nasa image earth orbiting space shuttle challenger beyond earth horizon captured mm camera onboard unmanned free flying shuttle pallet satellite spa busy flight sts mission le earth orbiting space shuttle challenger beyond earth horizon captured mm camera onboard unmanned free flying shuttle pallet satellite spa busy flight photo nasa image space shuttle atlantis land kennedy space center florida completing sts final mission nasa shuttle program july space shuttle atlantis land kennedy space center florida completing sts final mission nasa shuttle program july photo smiley n pool chronicle image year ago space shuttle columbia broke returning home back gallery february tragedy struck nasa family space shuttle columbia broke returning earth columbia broke apart flame foot texas killing seven astronaut minute glide landing florida journey begin nixon announced space shuttle program year ago approximately within second last communication received columbia crew resident texas louisiana reported hearing loud noise seeing debris falling sky remnant shuttle scattered across large part east texas entered atmosphere within hour local calling report piece spacecraft strewn property along road backyard incident claimed life seven astronaut came day seventeenth anniversary space shuttle challenger disaster history program despite hurdle space shuttle key grander vision commander rick husband pilot william mccool kalpana chawla michael anderson dr laurel clark dr david brown ilan ramon first israeli space lost life fourteen year later reminder columbia everywhere including sky everything asteroid lunar crater martian hill school park street even airport rick husband amarillo international airport bear columbia astronaut name pound wreckage representing percent nasa oldest space shuttle stored kennedy loaned engineering research wreckage serf training tool studying disaster like columbia
32410,independent co uk world europe greece wwii bomb evacuation thessaloniki html greece begin evacuation people discovery lb wwii bomb greek city begun evacuating around people clear way expert defuse lb unexploded second world war bomb device found thessaloniki country north earlier february construction work believed dropped air raid evacuee moved western suburb kordelio state emergency declared around police officer volunteer helping evacuation follows
146501,nymag thecut remember mom paid babysit html remember mom paid babysit photo klaus vedfelt getty image living york city college babysitting meant going apartment nicer mine getting paid sit someone else couch babysitting job glimpse possible future prewar apartment upper west side framed york post cover hanging bathroom fully renovated park slope townhouse stunningly attractive husband lived tribeca two bedroom side side washer dryer stokke high chair suggestion retaining pre kid style order possible price kid usually asleep arrived babysit parent still getting ready mom always mom let often holding glass wine acknowledged neither u ask could get glass decline imagining might happen disappear bedroom final touch took shoe settled couch flipped coffee table magazine trying seem natural possible look nice came back husband hovering doorway might something illuminating oh u ready leave needed make dinner reservation needed judge book read note fridge thinking forward time life like might mine babysitting job usually parent date night always family know beyond ad posted sittercity love reading book art project going playground playing pretend game cooking four year stopped babysitting woman messaged asked babysit old noting lived within mile marveled side month old tolerance pretend game last two minute night month old charge woke dark nursery tiny room kitchen upper west side prewar picked rocked back sleep stranger arrived put bed mom got back told seemed stunned kind size maybe thought suggested realizing might sound eight year later babysitter old never met told daughter woken able get back sleep turn feel shock tinge excitement could sadness tribeca washer dryer family mother disappeared exposed brick bedroom soon got home reemerging money pay back cash hand house seemed like height adulthood day keep envelope stuffed bill underwear drawer emergency time raid personal one like wanting stop atm adapted idea family first time daughter pooped potty went wipe heard saying touch toe something realized overheard mom tell preschooler decade marriage consider egalitarian arranges greets pay sitter performing weird dance learned turn still working john cheever inspired assumption strange husband text younger woman ask free welcome house give money end night toward end time living york city took daughter child museum upper west side realized woman stalled outside kid looked familiar older child pushing younger stroller realized woman whose month old babysat eight year rocked back sleep maybe thought old like sister mom recognized woman mid length brown hair stood green dress shoe yet handed post wd number realized fact around corner apartment child holding u anything maybe hello recognized face apartment ate cooky baby held dark maybe small gift already stunned much time passed remind maybe strange never really known anyway separately herded child along tag motherhood first person child care babysitting remember mom paid babysit share facebook tweet story top story ask bos shut mansplainer finally done white guy alia shawkat never clean haired girl viewed story former thinx employee accuses miki agrawal sexual harassment millennial pink refuse away finally done white guy michelle obama brunch sarah jessica parker gayle king robin robert ask bos shut mansplainer paris episode showed keeping kardashians could donald jr know everyone making fun sits relationship counselor big little lie tell u domestic violence soccer player accidentally thanks wife girlfriend awkward post game interview alia shawkat never clean haired girl partner kit keeping kardashians getting cancelled college fashion underrated icon eva chen mindbodygreen second numerology quiz predict powered pubexchange popular video cut without woman nyc latest cut p gorsuch flatly denies allegation dissed maternal leave colorado classroom nominee offered judiciary committee plausible alternative account alleged classroom incident p see photographer escape men marianna rothen show complicated think p many stealth question abortion neil gorsuch confirmation hearing addition grilled roe v wade scotus nominee field query litmus test weight precedent p student suing columbia say raped twice dorm room amelia roskin frazee lawsuit alleges university violated title ix p fear deportation lead woman drop domestic abuse case think ice agent targeting courthouse p fly without corsetlike sock get swollen foot cross country flight p remember mom paid babysit looking back mom p selena gomez say love depressing thing grim question interview selena gomez emo pop star time p meghan markle talk biracial hollywood interview pet peeve skin tone changed freckle airbrushed photo shoot p anna wintour daughter got engaged franca sozzani son match made vogue heaven p artist asking whitney take painting emmett till painting entitled open casket dana schutz p people sharing abortion story step u capitol meeting member congress part campaign lobby speakout p glowy product honor drake kanye glow glow p always carry tampon lesson learn woman white house alyssa mastromonaco memoir working white house guide book breaking p choose discount thing percent including michael kor wedge club monaco skirt p ask bos shut mansplainer keep assertive stop wearing gray shirt skeptical trying imagine wardrobe without couple counselor big little lie get right domestic violence show explores personal dynamic abuse people using eye makeup turn face viral meme saltbae hurt bae angela merkel sure love rummaging enormous handbag pen
74551,variety gallery oscar red carpet arrival gallery oscar red carpet arrival gallery variety isabelle huppert sparkled champagne armani prive best actress nominee ruth negga hit oscar carpet sporting aclu ribbon taraji p henson alberrta feretti dress backdrop stunning statement necklace emma robert wore vintage armani dress plunging neckline felicity jones opted pale colored dress barry jenkins looking make history tonight breakout film moonlight leslie mann looked like ray sunshine yellow gown chrissy teigen wore sparkly sexy zuhair murad gown sofia carson struck pose hosting oscar access web show sting wife trudie styler arrival line singer performing oscar nominated song jerry connell looked dapper traditional black tux ryan seacrest opted white jacket big event sunny pawar child actor lion gave enthusiastic thumb supermodel karlie kloss wore caped gown trend evening andrew garfield best actor award hacksaw ridge lucas hedge still believe oscar nominee saying feel like fairytale riz ahmed looked sharp royal blue zegna tux presenter hailee steinfeld brought drama high collared white iridescent ralph russo gown chrissy teigen john legend giving relationship goal carpet legend performing song la la land telecast justin timberlake playfully photobombed wife jessica biel jessica wore shimmery kaufman franco dress ava duvernay wore ornate ashi dress documentary oscar octavia spencer floated feathery marchesa gown kirsten dunst channeled old hollywood glamour christian dior petite kelly ripa wore voluminous navy ball gown gael garcia bernal many male attendee dressed dior homme director miranda july wore aclu ribbon red carpet david oyelowo jessica oyelowo jessica biel paired eye catching kaufman franco gown cartier jewel dev patel wore cream colored jacket arrived mom glen powell part hidden finger nominated dress luciana barroso wore dress plunging neckline best accessory husband matt damon michael j fox wife tracy pollan arrived arm arm tracy wearing project runway winner christian siriano teresa palmer sparkled silvery gown dakota johnson made statement champagne gucci dress cartier jewel janelle monae wore elie saab trademark black white usual image david fisher rex shutterstock
