,content
94412,cnet goldberg wwe fastlane wrestlemania kevin owen brock lesnar bill goldberg wwe champion cnet espa ol bill goldberg wwe champion commentary biggest pro wrestler king mountain good business wwe jeopardizing future dvanboom wwe legend goldberg best moment goldberg big night sunday fastlane relive even bigger night wwe network daniel van boom drag autoplay autoplay rock hulk hogan stone cold steve austin household name brief period late wrestler popular bill goldberg sunday fastlane event old goldberg became top man business bested kevin owen win wwe universal championship next month wrestlemania airing wwe network company biggest show headlined goldberg defends newly title brock lesnar year retirement goldberg man cost part time problem wwe last five year ongoing argument within wrestling business make sense part time star rock triple h brock lesnar show time take part marquee wrestlemania match icon often quantifiable impact rating intrigue casual fan time take opportunity away younger wrestler get relegated background role spotlight shine returning performer last triple h wrestled roman reign main event wrestlemania wrestled since undertaker made brief ring appearance since wrestlemania entering last month royal rumble veteran expected major part wrestlemania april returning star positioned strongly give impression full time performer dean ambrose kevin owen b team may lead dip business wwe careful rock faced john cena main event wrestlemania since wrestlemania main event consisted entirely full time wwe performer claim formula work wrestlemania headlined rock john cena return match touted company highest grossing event making wwe million wrestlemania featuring brock lesnar main event drew record million ticket sale alone last around people packed dallas texas stadium see triple h take roman reign big wrestlemania match lead big boost wwe network subscriber wwe gained paid subscriber network wrestlemania season another according wrestling observer downside last signed free month like netflix get first month free opted stay wrestlemania much could chalked freeloader big star leaving wrestlemania could certainly factor wwe conundrum goldberg v brock lesnar encapsulates perfectly big time every wwe star need know goldberg returned wwe last october originally scheduled big match brock lesnar survivor series november according wrestling observer return caused huge buzz big bump wwe rating making company change plan goldberg signed contract wrestle match culminating next month wrestlemania main event goldberg last match far year old originally thought wrestling match son could see perform meanwhile lesnar arguably wwe biggest star wrestle around five time set match wrestlemania past weekend goldberg beat former champion kevin owen full time star see every week monday night raw second rubbed fan wrong way especially brevity match recent year fan become accustomed longer hard fought main event goldberg two match since returning lasted combined minute second company wrote bout way make look dominating possible led question exciting mania bout main event last around minute understand could find second match little flat polarising issue among wrestling fan least matter win part time star walk wrestlemania wwe universal champion sure upset fan show pull around people orlando florida camping world stadium bring even wwe network wrestlemania streamed live subscriber come wrestlemania season wwe getting much viewer medium attention possible record break break mean whether mean using star work five night week five time share voice
145091,eonline casey wilson pregnant actress announces expecting second child husband david caspe casey wilson pregnant actress announces expecting second child husband david caspe casey wilson pregnant actress announces expecting second child husband david caspe donato sardella getty image destination maternity baby make four casey wilson announced exciting pregnant second child husband david caspe former star marry happy ending spilled detail today episode hit podcast fellow comedienne danielle schneider bitch sesh big end pregnant began saying opening convo schneider dished middle second trimester excited second arrival photo celeb baby bump feeling month feeling great told listener wilson caspe almost old son together max red undoubtedly going thrilled role big brother coming month past interview wilson made secret fact caspe wanted expand family come two kid family imagine going life without sibling especially later life told fit pregnancy second time parent tied knot back may front close friend family stunning outdoor wedding ojai calif actress hubby dating two year prior marrying another congratulation caspe family tag casey wilson baby pregnancy top story
170887,international wirestory mother backpacker slain australia criticizes mother backpacker slain australia criticizes mother backpacker slain australian hostel wrote open letter u president donald rejecting decision label daughter death terror attack august slaying mia ayliffe chung fellow briton tom jackson list attack white house executed inspired islamic state terror group reported medium rosie ayliffe possibility terrorism discounted early investigation daughter death used insane persecution innocent people wrote police australia allege suspect smail ayad shouted allahu akbar arabic phrase meaning god great attack indication assault motivated extremism investigating whether ayad french old time killing romantic obsession ayliffe chung attack took place front dozen backpacker hostel northern queensland ayliffe chung found dead scene jackson tried stop attack fatally wounded vilification whole nation state people based religion terrifying reminder horror ensue allow led ignorant people darkness hatred ayliffe wrote
170752,sciencealert tiny fish giant fang inject heroin like venom predator tiny fish us giant fang inject heroin like venom predator anthony toole tiny fish us giant fang inject heroin like venom predator nature savage mar scientist discovered chemically unique venom small tropical fish known fang blenny unlike venomous creature blenny use venom capturing prey use escape predator getting high brightly coloured blenny popular choice home aquarium turn harbour fascinating evolutionary secret relatively giant fang small fang blenny constantly threat predator gobble whole happen end something else mouth sink powerful lower canine predator slacken jaw swim away unharmed behaviour first described year ago zoologist george losey tested blenny venom mouse sure venom actually worked toxicity bite meiacanthus atrodorsalis assayed force biting tail two white laboratory mouse hand losey wrote paper subsequent observation inadvertently provided bite tender area hip international team biologist finally discovered compound found venom blenny meiacanthus genus readily injected losey skin back typically expect venomous fish bite deliver excruciating pain least venomous fish wild deliver venom spine fin tail back brush leave agony day fang blenny venom totally different two fish specie inject venom via biting like snake specie deep sea eel scientist know little fang blenny venom cause pain contains opioid hormone used thinking painkiller venom chemically unique fish injects fish opioid peptide act like heroin morphine inhibiting pain rather causing say co lead researcher brian fry university queensland australia scan venomous fang blenny anthony romilio team member irina vetter clarified ed yong atlantic mean blenny venom act painkiller predator substance released brain type activity unlikely relieve pain bitten fish get brain way instead researcher think venom crash predator blood pressure making faint dizzy loosens grip let blenny escape apart analysing cool venom team investigated mechanism blenny use protect mimicry blenny pretty large group fish even among one fang evolved impressive venom gland team discovered many type harmless coral reef fish including non venomous fang blenny freeride evolutionary feat copy colour pattern swimming style venomous blenny successfully fishy life without eaten venom research exciting field let scientist discover compound potential use medicine alternative current painkiller drug protects people stroke snake scorpion spider usual suspect kind research many venomous fish could find useful chemical research published current biology minute ago age number hour ago
149176,nydailynews entertainment music kendrick lamar slam president chump song article kendrick lamar slam president chump song kendrick lamar release song heart part slam president chump kendrick lamar slam president chump song kendrick lamar song includes shot president mark von holden mark von holden invision ap friday march clearly president strike negative chord rapper kendrick lamar hip hop wordsmith bash america commander chief politically charged track heart part dropped late thursday night donald chump know feel punk lamar rap verse tell em god comin russia need replay button something electoral vote look like memorial vote america truth ignorin vote lamar lyrical take president come roughly midway five minute track call another unnamed rapper base heavy single well donald white house rapper may hint song album fast approaching toward end lamar cryptically declares know time ante forever got till april th get ya together apple music release mark lamar first musical output since last march dropped album untitled unmastered lamar latest figure rap realm take shot following footstep snoop dogg recently premiered music video show pointing fake gun head clown inspired president president subject verse kendrick lamar song john minchillo ap later bashed gin juice rapper video suggested act could worthy time behind bar imagine outcry snoopdogg failing career aimed fired gun president obama tweeted earlier month jail time join conversation
46344,rappler nation international intervention human right watch ph drug war hrw war drug ph need international intervention philippine hrw war drug ph need international intervention describing philippine situation human right calamity human right watch deputy director phelim kine say philippine need urgent international intervention address human right violation published human right human right watch deputy director philem kine say human right problem country require international intervention photo marvin tandayu boston usa philippine need global intervention address human right violation involving country war drug according human right watch deputy director phelim kine saturday february harvard project asian international relation hpair conference held harvard university advocating way current form philippine government fix need urgent international intervention international body investigation kine explained speaking asian youth delegate humanitarian affair panel conference kine human right violation philippine unique distressing president giving full support president active cheerleader promised rally right election fill manila bay body thousand suspected drug user rare politician deliver promise unfortunately extremely abusive kine since june drug suspect killed police drug operation others murdered unidentified gunman vigilante despite drug related killing continued latest police tally given agence france presse showed murder case investigation february since duterte ordered pnp withdraw war drug right group proved extrajudicial killing slowed discontinued describing philippine situation human right calamity kine happening country surprising unfortunate considering country history ferdinand marcos multi decade authoritarian dictatorship resulted strong civil society free medium tragedy philippine right sizeable part philippine population decided accepted segment population disposable human right advocate added watchdog kine criticized leftist human right group philippine specifically karapatan alliance individual group organization working promotion protection human right supposedly staying silent extrajudicial killing president duterte identified leftist complete abrogation betrayal civil society role think really need radical self examination self proclaimed watchdog public good fail plus people decided people worth protecting kine suggested campaign promise duterte includes ending insurgency communist rebel killed around people cpp claim cadre military put number around however philippine president recently scrapped talk immunity ndf consultant day communist armed wing people army npa terminated month old unilateral ceasefire supposed ceasefire abuse military kine ended talk emphasizing role human right defender country war drug adding serve watch minority depredation majority place minority turn dynamic around rappler
6985,fortune hamburger cow heart hamburger beef producer permitted use certain part cow heart deemed beef heart meat hamburger rule go back definition set forth congress federal meat inspection act going back united state department agriculture food safety inspection service defines beef heart meat cardiac muscle trimmed ventricular wall beef heart contrast usda defines beef heart portion heart cap e efferent afferent vessel pericardial fat atrium auricle cranial atrio ventricular septum clearly demarcated ventricular portion heart coronary band beef heart opposed beef heart meat permitted component chopped beef ground beef hamburger correction earlier version story incorrectly stated usda food safety inspection service changed policy regarding part cow heart allowed included chopped beef ground beef hamburger usda policy regarding component remained since rule first enacted
39831,breitbart big government ten arrested four illegal alien savage gang related killing maryland teen four illegal alien arrested savage gang related killing md teen ten arrested including four illegal alien savage gang related killing maryland teen twitter wusa katie mchugh imported gang violence continues afflict virginia authority charged illegal alien suspect murder ten suspect gang participation abduction thursday brutal slaying old damaris reyes rivas police arrested ten connection rivas death four adult six teenager fox report jose ivan castillo rivas springfield wilmer sanchez serrano cindy blanco hernandez aldair j miranda carcamo adult another old venus iraheta lived u past ten year making dreamer eligible amnesty obama executive order police custody police identify five juvenile ten face charge abduction gang participation rivas serrano charged murder rivas died close january upper body trauma savage brutal killing fairfax county police chief edwin roessler police reportedly found video evidence rivas death declined name gang connected teenager murder according maria reyes rivas mother daughter gotten involved el salvadoran gang mara salvatrucha m recently told fox receiving violent threat gang member blaming arrest afraid life u immigration custom enforcement placed detainers four adult charged murder asked fairfax county alert released custody fifth total population el salvador life u el salvador top country birth immigrant virginia associated press reported nearly quarter percent northern virginia resident foreigner percent state foreign born population life researcher found resident virginia foreign born nine roughly illegal alien live virginia according estimate meaning state rank top ten state largest population illegals among nearly illegals el salvador another estimate pegged total number illegals percent state population similarly immigration led boom latino hispanic population old dominion since latino share virginia population grew percent percent percent people according american immigration council without immigration el salvador m america fewer machete murder dismembered body buried idyllic park since m operated washington c area thousand member obama administration policy encouraged hundred thousand central american illegal alien surge u administration helped along shipping unannounced unsuspecting american community m leader stationed el salvador told u based gang rebuild large influx young illegal alien made task easier obama administration shipped illegal alien minor clear m tie m stronghold department homeland security official noted uptick m gang violence past two year according fox old high school work recruit younger kid help carry crime aware charge le serious juvenile el salvadoran national involved gang violence home bring connection plan expansion united state chairman northern virginia regional gang task force douglas w keen pointed increased recruitment unaccompanied minor illegally arriving u debrief arrestees telling u recruited young age encouraged commit crime assault larceny move narcotic violent crime keen told washington post director task force jay lanham told fox gang recruiting people young child elementary school lure social medium party offer drug alcohol sex taxpayer course foot bill illegal alien schooling social service trial incarceration specialized task force required keep explosive violence control immigration crime damaris reyes rivas el salvador hispanic immigration immigrant crime maryland m virginia
139833,themarysue hogwarts haggadah want passover harry potter haggadah yer moses parallel harry want passover harry potter haggadah yer moses parallel harry kaila hale stern march nd passover long favorite jewish holiday celebration involves singing eating storytelling four required cup wine passover got even magical thanks unofficial hogwarts haggadah saw friend sm rosenberg post hogwarts haggadah facebook learn immediately know closely tied production turn sm father moshe rosenberg congregational rabbi kew garden hill queen combining harry potter judaism educational purpose almost year harry potter writing club elementary school kid featured york time back rabbi rosenberg came idea harry potter themed haggadah year ago decided self publishing route working graphic designer aviva shur brought page part upcoming seder get ready pesach filtered harry famous glass haggadah text act guide order passover seder favorite thing passover two seder seen feminist oriented haggadah haggadah centered around music passover often attend seder haggadah lovingly pieced together different book sort pick choose tradition currently popular amazon haggadah themed baseball writer dave barry speak rabbi rosenberg take harry potter passover bestselling haggadah mention feature harry potter themed song sung key passover staple like chad gadya sm tell father found boy wizard adventure passover natural combination hp passover share many basic theme education parent child relationship sharing wealth thrilled enthusiastic response unofficial hogwarts haggadah facebook page measure interest got like week sold copy since book debut march working distributor get haggadah store across country country like israel australia canada demand love response rabbi rosenberg gave interview forward review q hogwarts student think host best seder rabbi rosenberg point seder make participant enable apply lesson exodus life seder leader must guide without forcing reason hermione knowledgeable drive everyone crazy advisory role want idea activity coming fred george weasley passover coming soon chance win autographed copy unofficial hogwarts haggadah sm nice jewish fangirls podcast week hosting rabbi rosenberg guest diving link magical world jewish holiday redemption excuse think fred george weasley organizing hunt akifoman unofficial hogwarts haggadah amazon image moshe rosenberg aviva shur follow mary sue twitter facebook tumblr pinterest google follow mary sue
49426,vogue article london fashion week spring burberry front row beauty immy suki waterhouse suki immy waterhouse take bedhead brow burberry spring front row suki immy waterhouse turn bedhead sister signature burberry front row february calin van paris photo getty image burberry parade slicked back updos minimalist makeup runway made case polished take brit beauty fashion house front row offered compelling counter theory sister suki immy waterhouse longtime fan label arrived evening show wearing crop top trademark take bohemian bedhead suki shoulder sweeping blonde finished bounce curl sideswept bang calling mind slept rock n roll glamour era anita pallenberg meanwhile immy waist length center parted style swung loose shoulder finished hint glastonbury ready bend addition shared shade golden blonde sister beauty signature common form twinning brushed brow palette cool pink makeup proof dramatic haircut quick change red lip worth weight shock value smartly reworked beauty classic always turn head
138008,dailycaller considering carbon tax considering carbon tax white house considering tax carbon dioxide fight global warming according administration official administration considering carbon tax white house spokeswoman lindsay walter according axios shortly press secretary sean spicer gave ambiguous answer subject asked reporter tuesday press briefing part national economic council responsibility coordinating economic policy president listen range viewpoint various issue official told axios spicer dodged similar question february report came white house official met former republican official pitched replacing federal regulation revenue neutral carbon tax small band republican pressuring lawmaker publicly back carbon tax fight global warming climate leadership council met white house official february pitch carbon tax council republican include former secretary state james baker former treasury secretary henry paulson former cabinet official george shultz plan argues revenue neutral carbon tax shrink overall size government streamlining regulatory state problem carbon tax backer president donald promised campaign back carbon tax promised eliminate percent federal regulation undo president obama climate action plan grand bargain made swapping regulation carbon tax republican support carbon tax party platform reject global warming tax arguing increase energy price across board hitting hardest family already struggling pay bill democrat growth economy handful republican lawmaker capitol hill come favor measure reduce global warming thirteen house republican joined climate solution caucus created find way curb global warming republican recently made public overture party put forward solution global warming deal alternative fact alternative reality south carolina rep mark sanford deal whatever consensus starting point legitimate debate exist listening president expected issue executive order coming day week roll back obama signature regulation limiting carbon dioxide emission power plant order expected undo department interior moratorium coal mining lease obama administration guidance girding global warming regulation follow michael facebook twitter content created daily caller foundation available without charge eligible publisher provide large audience licensing opportunity original content please contact email protected
